{
  "$schema": "./progress.schema.json",
  "spec_version": "1.0.0",
  "project": "downpour",
  "updated_at": "2026-08-05T02:23:10Z",
  "updated_by": "claude-code",
  "current_stage": "S2",
  "stages": [
    {
      "id": "S0",
      "name": "Foundations: specs, ADRs, agent harness, CI skeleton",
      "status": "complete",
      "started_at": "2026-08-02T00:00:00Z",
      "completed_at": "2026-08-03T11:44:43Z",
      "spec": "docs/12-roadmap-stages.md",
      "exit_criteria": [
        {
          "id": "S0-C1",
          "text": "Every ADR is accepted or explicitly deferred with a named reversal trigger",
          "met": true,
          "evidence": "docs/adr/0001..0009 all carry Status and Reversal trigger sections",
          "invariants": []
        },
        {
          "id": "S0-C2",
          "text": "node scripts/check-progress.mjs passes against this file",
          "met": true,
          "evidence": "node scripts/check-progress.mjs exits 0; verified 2026-08-02",
          "invariants": []
        },
        {
          "id": "S0-C3",
          "text": "bash scripts/doctor.sh runs clean on the development machine",
          "met": true,
          "evidence": "bash scripts/doctor.sh exits 0; rustc/cargo 1.97.1 + all required cargo tools present",
          "invariants": []
        },
        {
          "id": "S0-C4",
          "text": "CLAUDE.md and AGENTS.md agree with each other and with docs/",
          "met": true,
          "evidence": "Both written in the same change; rules sections mirrored",
          "invariants": []
        },
        {
          "id": "S0-C5",
          "text": "A fresh agent session can read CLAUDE.md then HARNESS.md then progress.json and correctly state what to work on next, without asking",
          "met": true,
          "evidence": "Session 2026-08-03T11:44Z (claude-code, no prior context): read CLAUDE.md then docs/agent/HARNESS.md then state/progress.json then CONTEXT-MAP.md and stated unprompted that S0 was active with 17/17 tasks done, that S0-C5 was the only unmet criterion, and that the next work was the S0 gate followed by S1 per docs/03-transfer-engine-spec.md sections 1-2. Reproducible: `just brief` prints the same stage, open tasks and unmet criteria.",
          "invariants": []
        },
        {
          "id": "S0-C6",
          "text": "Repository skeleton complete: LICENSE, SECURITY.md, CONTRIBUTING.md, CI workflow",
          "met": true,
          "evidence": "LICENSE, SECURITY.md, CONTRIBUTING.md, CODE_OF_CONDUCT.md, CHANGELOG.md all present at root; CI workflow present. NOTE: the CI workflow was .gitlab-ci.yml when S0 closed and is now .github/workflows/ci.yml, with the GitLab config retained at .gitlab-ci.yml.disabled (ADR-0011). The criterion is still satisfied; only the path changed.",
          "invariants": []
        }
      ],
      "tasks": [
        {
          "id": "S0-T1",
          "title": "Write the docs/ specification set",
          "status": "done",
          "proof": "docs/00 through docs/14 exist and are cross-referenced by docs/agent/CONTEXT-MAP.md",
          "files": [
            "docs/"
          ],
          "blocked_by": null,
          "notes": null,
          "invariants": []
        },
        {
          "id": "S0-T2",
          "title": "Write ADRs 0001-0009",
          "status": "done",
          "proof": "docs/adr/README.md index lists all nine with matching files",
          "files": [
            "docs/adr/"
          ],
          "blocked_by": null,
          "notes": null,
          "invariants": []
        },
        {
          "id": "S0-T3",
          "title": "Write the agent harness (HARNESS, WORKFLOW, INVARIANTS, DoD, CONTEXT-MAP, CODEX-NOTES)",
          "status": "done",
          "proof": "docs/agent/ complete; referenced from CLAUDE.md and AGENTS.md",
          "files": [
            "docs/agent/"
          ],
          "blocked_by": null,
          "notes": null,
          "invariants": []
        },
        {
          "id": "S0-T4",
          "title": "Create progress.json, its schema, and the validator",
          "status": "done",
          "proof": "node scripts/check-progress.mjs exits 0 against state/progress.json",
          "files": [
            "state/",
            "scripts/check-progress.mjs"
          ],
          "blocked_by": null,
          "notes": null,
          "invariants": []
        },
        {
          "id": "S0-T5",
          "title": "Configure Claude Code: settings, rules, always-on skills, hooks",
          "status": "done",
          "proof": ".claude/ populated; hooks referenced from .claude/settings.json",
          "files": [
            ".claude/"
          ],
          "blocked_by": null,
          "notes": null,
          "invariants": []
        },
        {
          "id": "S0-T6",
          "title": "Configure Codex: .codex/config.toml and CODEX-NOTES",
          "status": "done",
          "proof": ".codex/config.toml exists; docs/agent/CODEX-NOTES.md documents the divergences",
          "files": [
            ".codex/"
          ],
          "blocked_by": null,
          "notes": null,
          "invariants": []
        },
        {
          "id": "S0-T7",
          "title": "Build the in-repo plugin marketplace",
          "status": "done",
          "proof": "plugins/.claude-plugin/marketplace.json validates; three plugins present",
          "files": [
            "plugins/"
          ],
          "blocked_by": null,
          "notes": null,
          "invariants": []
        },
        {
          "id": "S0-T8",
          "title": "Write scripts/doctor.sh environment check",
          "status": "done",
          "proof": "bash scripts/doctor.sh exits 0 with all required tools present",
          "files": [
            "scripts/doctor.sh"
          ],
          "blocked_by": null,
          "notes": null,
          "invariants": []
        },
        {
          "id": "S0-T9",
          "title": "Install the missing toolchain on the development machine",
          "status": "done",
          "proof": "bash scripts/doctor.sh exits 0 with no required items missing",
          "files": [],
          "blocked_by": null,
          "notes": null,
          "invariants": []
        },
        {
          "id": "S0-T10",
          "title": "Add LICENSE (Apache-2.0), SECURITY.md, CONTRIBUTING.md, CODE_OF_CONDUCT.md",
          "status": "done",
          "proof": "LICENSE (Apache-2.0), SECURITY.md, CONTRIBUTING.md, CODE_OF_CONDUCT.md, CHANGELOG.md exist and are linked from README.md; scripts/check-links.sh passes",
          "files": [],
          "blocked_by": null,
          "notes": null,
          "invariants": []
        },
        {
          "id": "S0-T11",
          "title": "Add the CI workflow skeleton (fmt, clippy, test, check-progress)",
          "status": "done",
          "proof": "CI workflow present with a harness stage that runs on every commit and Rust jobs guarded on Cargo.toml existing. Originally .gitlab-ci.yml; superseded in S1 by .github/workflows/ci.yml after the GitLab quota was exhausted (ADR-0011). The GitLab config is kept current and disabled at .gitlab-ci.yml.disabled.",
          "files": [],
          "blocked_by": null,
          "notes": null,
          "invariants": []
        },
        {
          "id": "S0-T12",
          "title": "git init and the first commit",
          "status": "done",
          "proof": "git log shows commit 803636b on master and develop, both pushed to gitlab.com/duochou042004/downpour; pipelines #1 and #2 green",
          "files": [],
          "blocked_by": null,
          "notes": null,
          "invariants": []
        },
        {
          "id": "S0-T13",
          "title": "Complete the Codex agent surface (marketplace, skills, verified capabilities)",
          "status": "done",
          "proof": "codex debug prompt-input lists all 9 Downpour skills; codex plugin list shows 4 plugins from the downpour-tools marketplace",
          "files": [
            ".agents/plugins/marketplace.json",
            "plugins/downpour-harness/",
            "docs/agent/CODEX-NOTES.md"
          ],
          "blocked_by": null,
          "notes": null,
          "invariants": []
        },
        {
          "id": "S0-T14",
          "title": "Agent-agnostic enforcement via git hooks",
          "status": "done",
          "proof": ".githooks/pre-commit blocked its own first run on a real shellcheck finding in scripts/check-links.sh",
          "files": [
            ".githooks/pre-commit",
            "justfile"
          ],
          "blocked_by": null,
          "notes": null,
          "invariants": []
        },
        {
          "id": "S0-T15",
          "title": "Single-source agent assets with drift detection",
          "status": "done",
          "proof": "scripts/sync-agent-assets.sh --check exits 0; enforced by pre-commit and the agent-assets CI job",
          "files": [
            "scripts/sync-agent-assets.sh"
          ],
          "blocked_by": null,
          "notes": null,
          "invariants": []
        },
        {
          "id": "S0-T16",
          "title": "README with badges, mermaid diagrams and the scorecard",
          "status": "done",
          "proof": "scripts/check-links.sh passes over 115 relative links including every README target",
          "files": [
            "README.md"
          ],
          "blocked_by": null,
          "notes": null,
          "invariants": []
        },
        {
          "id": "S0-T17",
          "title": "Publish to GitLab with master/develop branch protection",
          "status": "done",
          "proof": "glab api protected_branches shows master push='No one', develop push='Maintainers'; default_branch=develop; only_allow_merge_if_pipeline_succeeds=true",
          "files": [],
          "blocked_by": null,
          "notes": null,
          "invariants": []
        }
      ]
    },
    {
      "id": "S1",